{
  "schemaVersion": 1,
  "name": "ending_amulets",
  "size": {
    "w": 16,
    "h": 16
  },
  "origin": {
    "x": 8,
    "y": 16
  },
  "legend": {
    ".": -1,
    "K": 0,
    "y": 6,
    "w": 7,
    "R": 10,
    "G": 12,
    "Y": 14,
    "W": 15
  },
  "frames": [
    {
      "id": "twin",
      "rows": [
        "......KyyK......",
        "....KKKKKKKK....",
        "...KwwwwyyyyK...",
        "..KwwWWWwYYyyK..",
        ".KwwWWWWKYYYyyK.",
        ".KwWWWWWKYYYYyK.",
        "KwwWWWWWwYYYYyyK",
        "KwWWWWWWKYYYYYyK",
        "KwWWWWWWGYYYYYyK",
        "KwWWWWWGGYYYYYyK",
        "KwwWWWWWKYYYYyyK",
        ".KwWWWWWKYYYYyK.",
        ".KwwWWWWwYYYyyK.",
        "..KwwWWWKYYyyK..",
        "...KwwwwKyyyK...",
        "....KKKK.KKK...."
      ]
    },
    {
      "id": "sun",
      "rows": [
        ".......K........",
        "......KyK.......",
        "..KK..KYK...KK..",
        ".KyYK.KYKK.KYyK.",
        "..KKYKyyyyKYKK..",
        "....KyYYYYyK....",
        "...KyYYYYYYyK...",
        "KKKKyYYWRYYyKKKK",
        "yYYyYYRRRRYYyYYy",
        "KKKKyYYRRYYyKKKK",
        "...KyYYYYYYyK...",
        "....KyYYYYyK....",
        "..KKYKyyyyKYKK..",
        ".KyYK.KKKK.KYyK.",
        "..KK...KYK..KK..",
        ".......KyK......"
      ]
    }
  ],
  "mirror": {
    "twin_l": {
      "from": "twin",
      "flipX": true
    },
    "sun_l": {
      "from": "sun",
      "flipX": true
    }
  }
}
