{
  "schemaVersion": 1,
  "name": "vermin_earwig",
  "size": {
    "w": 16,
    "h": 12
  },
  "origin": {
    "x": 8,
    "y": 12
  },
  "legend": {
    ".": -1,
    "K": 0,
    "r": 2,
    "y": 6,
    "R": 10
  },
  "frames": [
    {
      "id": "walk0",
      "rows": [
        "................",
        "................",
        "................",
        "................",
        "................",
        "...............K",
        ".KK.........K.Ky",
        "KRRKKKKKKKKKrKyy",
        ".KRRyyrrryyrrryK",
        ".KKRyyrrryyrrrK.",
        "KRRKKyyKyyyyKK..",
        "KRK.KyKKyKyK...."
      ]
    },
    {
      "id": "walk1",
      "rows": [
        "................",
        "................",
        "................",
        "................",
        "...............K",
        "..............Ky",
        ".KK.........KKyy",
        "KRRKKKKKKKKKrKyK",
        ".KRRyyrrryyrrryK",
        ".KKRyyrrryyrrrK.",
        "KRRKKKyKKyKyKK..",
        "KRK..KyyKyyyyK.."
      ]
    }
  ],
  "mirror": {
    "walk0_l": {
      "from": "walk0",
      "flipX": true
    },
    "walk1_l": {
      "from": "walk1",
      "flipX": true
    }
  }
}
