{
  "schemaVersion": 1,
  "name": "scenery_7523",
  "size": {
    "w": 64,
    "h": 56
  },
  "origin": {
    "x": 0,
    "y": 0
  },
  "legend": {
    ".": -1,
    "K": 0,
    "r": 2,
    "g": 4,
    "y": 6,
    "R": 10,
    "G": 12,
    "Y": 14,
    "W": 15
  },
  "frames": [
    {
      "id": "f0",
      "rows": [
        "......................................KGGGGgGGGgK...............",
        ".....................................KGgGGgGGgGGGKKK............",
        "....................................KGGGgggGGGggGGggKK..........",
        "..............KKKKK................KgGggGGGGGGGGgGGGGGK.........",
        "............KKGGGgGKKKK...........KgGggGGGGGGGGGggGGgGGK........",
        "...........KGGGGgGGGGggKK........KgGGGGGGGGGGGGGGgGGGgGK........",
        "..........KKGGgGGGGggGGGgK......KKGGggGGGGGGGGGGGggGGGK.........",
        ".........KgggggGGGGGGGgGggK....KgGGGgGGGGyyRRyyGGGgGGGKK........",
        ".........KgGGGGGGGGGGGGgGGgK..KKgGGGgGGGyyyyyyyyGGggGGGgK.......",
        ".........KGGGGGGGGGGGGGgGGGgKKGGgGGGgGGKyyyyyyyyKGGgGKGgGK......",
        "........KGGGGGGGGGGGGGGggGGGK.KggGGKgGKGKyyRRyyGGGGgKGGggGK.....",
        ".......KGGGGGGKyyRRyyGGGgGGGKKKgKKKgKGKGKKKRRRKKGKGggGKGgK......",
        "......KGGGggGKyyyyyyyyGGggGGGgKKKKKKKKGK...KrrrKGKGKKK.KgK......",
        "......KGKGgKGKyyyyyyyyKGGgGGGgGGGGGGGKK....KrrrKKGK.....K.......",
        "......KGGKgGKGKyyRRyyGGGGgKGGGGgGggGGGK....KRRRK.K..............",
        ".......KK.KKGGKKRRRKKKGKGKgGGGGGGGGGGGGKK..KRRRK................",
        "............KKKrrrK..KGGKKGGGGGGGGGGGggGGK.KrrrK................",
        "..............KrrrK...KKKGGgGGGGGGGGGGgGGKKKrrrK................",
        "..............KRRRK...KGKGgGGGGGGGGGGGggGGGKRRRK................",
        "..............KRRRK..KKGGGgGGGGYYYKGKGKgGGGKKRRRK...............",
        "..............KrrrK.KgGGGKgGGGGyyyKKGKGggGGGgrrrK...............",
        "..............KrrrK.KgGKGgKGKGKyyyKKGKGKgGKGgrrrK...............",
        ".............KRRRK.KGgGGKgGGGGKYYYK.KGKGgKGGggRRK...............",
        ".............KRRRK.KgGKGKgGKGKKYYYK.KGKGK.KKKgRRK...............",
        ".............KrrrK.KgK.K.KKKGKKyyyK..KGK....KrrrK...............",
        ".............KrrrK..K.......K.KyyyK...K.....KrrrK...............",
        ".............KRRRK............KYYYK.........KRRRK...............",
        ".............KRRRK............KYYYK.........KRRRK...............",
        ".............KrrrK............KyyyK..........KrrrK..............",
        ".............KrrrK............KyyyK..........KrrrK..............",
        ".............KRRRK............KYYYK..........KRRRK..............",
        "............KRRRK.............KYYYK..........KRRRK..............",
        "............KrrrK.............KyyyK..........KrrrK..............",
        "............KrrrKKKK...KKKKKK.KyyyK.......KKKKrrrK..............",
        "............KRRRGgGGK.KGGGgGGKKYYYK..KKKKKGGGGRRRK.....KKK......",
        "..........KKKRRRGGGGGKGGGgGGGGKYYYKKKGgGGGGGGGRRRKKK.KKGGgKK....",
        "......KKKKgGGrrrgGGGGGGGGGGGGGGyyyKgGGGGGGGgGGrrrGGGKGGGGGGGKK..",
        "....KKGGGGGGGrrrgGGGGgGGGGGGGGGyyyGGGGGgGgGGGGrrrGGggGGGGgGGGGK.",
        "...KGggGGGGGGRRRGgGGGGGGGGGGGGGYYYGgGGGGGGGGGGRRRGGGgGGGGGGgGGgK",
        "..KGGGGGGGggGRRRGGGggGGgGGGGGGgYYYGGGGgGgGgGGGRRRGGGGGGGGGGGGGGK",
        ".KGGgGGGGGGGGrrrGGGGgGGGGGGGGGGyyyGGGGGGGGGGGGrrrGGGGGGGGGgGGGGK",
        ".KGGGGGgGGGGGrrrGGGGGGGgGGGGGGGyyyGGGGGGGGgGGGrrrGgGGGGGGGGggGGK",
        ".KGGGGGGGGGgGRRRGGGGGGGggGGGGggYYYGGGgGGGGGGgGRRRGgGGGGgGGGgGGGK",
        "..KGGGggGGGGGRRRGGgGGGGGGGgGGgGYYYGKGGGGGGKKGGRRRGGGGGGGGGGGGggG",
        ".KKGgGGGGGgGGrrrGGGGGGGGGGGGgGGyyyGGKKKKKGGgKgrrrGgGgGGgGGGGggGG",
        "KGGGGGggGGGggrrrGGGGgGGGGGggGGGyyyGGGGGGgGGGGGrrrGGGGGGGGGGGGGGK",
        "KGGGGgGgGGGGGRRRGGGGGGGgGGgGGGGYYYgGGGGGGGGGGGRRRGGGgGgGgGGGgGGG",
        "KGGGGGGgGGGgGRRRGGGgGGgGGGGGGggWWGGGGGGGGGGGGGRRRGgGGGGGGGGGGGGG",
        "KGGGGGGGGGGGGrrrgGGGGGGGgGGGGGGWWGggGGGGGGGGGgrrrGgGGGGGggGGGGgK",
        "KGGGGgGGGGgGGrrrGGGGgGGGgggggGGWWWWWWGGWGgGGGGrrrGGGGGGGGGGGGGGK",
        "KgGGGGGGGGGGGRRRGGGGGGGGGgGggGWWWGGGWWWWWGGGGGGRRRgGGGGGGGGGGGGK",
        "KGGGGGGgGGGGGGgGGgGGGGgGgGGGgWWWGWgGgGgWWGGGGgGGGGGGGGgGGGGGGGgK",
        "KGGgGGgGGGgGGGgGgGGgGGGGGGgGWWWWGWWGGGGGGGGGGGgGGGGGGGGGGGGGGGGK",
        "KGGGGGGGgGgGgGGGGGGGGGGGGgWWWWWWGWWGGGGGGGGGGGGGGGgGGGGGgGgGGGGK",
        "KGGGGGGGGGGGGGgGggGgGGGGGgWWWWWWGGGgGgGGGGGGGGGgGGGGgGgGGGGGGGGK",
        "KGgGGGggGGgGGGGGGGGGGGGGGGGWWGWWGGGGGGGGGGGGGGGGGGGGGGGgGgGGGGGK"
      ]
    }
  ]
}
