{
  "schemaVersion": 1,
  "name": "puff",
  "size": {
    "w": 12,
    "h": 12
  },
  "origin": {
    "x": 6,
    "y": 12
  },
  "legend": {
    ".": -1,
    "Y": 14,
    "W": 15
  },
  "frames": [
    {
      "id": "f0",
      "rows": [
        "............",
        "............",
        "...YYYWWW...",
        "...YYYWWW...",
        "..WYYWWWWY..",
        ".WWWWWWWYYY.",
        ".WWWWWWWYYY.",
        "..WWYWWWWY..",
        "...YYYWWW...",
        "...YYYWWW...",
        "............",
        "............"
      ]
    },
    {
      "id": "f1",
      "rows": [
        ".....YY.....",
        ".....YY.....",
        ".W.......WW.",
        "WWW......WW.",
        ".W........W.",
        "............",
        "............",
        ".Y........Y.",
        ".YY......YYY",
        ".YY.......Y.",
        ".....WW.....",
        ".....WW....."
      ]
    }
  ],
  "mirror": {
    "f0_l": {
      "from": "f0",
      "flipX": true
    },
    "f1_l": {
      "from": "f1",
      "flipX": true
    }
  }
}
