{
  "schemaVersion": 1,
  "name": "vermin_bird",
  "size": {
    "w": 16,
    "h": 12
  },
  "origin": {
    "x": 8,
    "y": 12
  },
  "legend": {
    ".": -1,
    "K": 0,
    "b": 1,
    "B": 9,
    "Y": 14,
    "W": 15
  },
  "frames": [
    {
      "id": "walk0",
      "rows": [
        "................",
        "................",
        "...K............",
        "..KbKK.....K....",
        "...KbbKKKKKBK...",
        ".KKKbbbbBBBBKKKK",
        "KbbKKbbBBBBBBYYY",
        ".KbbKBBBBBBBKKKK",
        "..KK.KBBBWKK....",
        "......KKKK......",
        "................",
        "................"
      ]
    },
    {
      "id": "walk1",
      "rows": [
        "................",
        "................",
        "................",
        "...........K....",
        "......KKKKKBK...",
        ".KK..KBBBBBBKKKK",
        "KbbKKBBbBBBBBYYY",
        ".KbbKbbBBBBBKKKK",
        "..KKbKBBBWKK....",
        "..KbK.KKKK......",
        "...K............",
        "................"
      ]
    }
  ],
  "mirror": {
    "walk0_l": {
      "from": "walk0",
      "flipX": true
    },
    "walk1_l": {
      "from": "walk1",
      "flipX": true
    }
  }
}
