{
  "schemaVersion": 1,
  "name": "scenery_872a",
  "size": {
    "w": 32,
    "h": 48
  },
  "origin": {
    "x": 0,
    "y": 0
  },
  "legend": {
    ".": -1,
    "K": 0,
    "y": 6,
    "Y": 14
  },
  "frames": [
    {
      "id": "f0",
      "rows": [
        "..KKKKKKKKKKKKKKKKKKKKKKKKKKKK..",
        ".KYYYYYYYYYYYYYYYYYYYYYYYYYYYYK.",
        "KYYYYYYYYYYYYYYYYYYYYYYYYYYYYYYK",
        "KYYYyYYYYYyYYYYyYYYyYYKYYyYYyyYK",
        "KYYYyYYYYYyYYYYyYYYYyYKKYyYYyyYK",
        "KYYYyYYYYYYyYYyYYYYyYKYYKYyYyyYK",
        "KYYYyYYYYYYyYYYyYYYYyYYYYKyYyyYK",
        "KYYYyYYYYYYyYYYyYYYYyYYYYKyYyyYK",
        "KYYYyYYYYYyYYYYyYYYYyYYYYYKYyyYK",
        "KYYYyYYYYYyYYYYyYYYYyYYYYYKYyyYK",
        "KYYYyYYYYYyYYYyYYYYYYyYYYYKYyyYK",
        "KYYYyYYYYYyYYYyYYYYYYyYYYYyKyyYK",
        "KYYYYyYYYYYyYYyYYYYYYyYYYYKYyyYK",
        "KYYYYyYYYYyYYYyYYYYYYyYYYYyYyyYK",
        "KYYYyYYYYYYyYYyYYYYYYYyYYYyYyyYK",
        "KYYYYyYYYYYyYYyYYYYYYYyYYyYYyyYK",
        "KYYYYyYYYYYyYYyYYYYYYyYYYyYYyyYK",
        "KYYYyYYYYYYyYYyYYYYYYYyYYyYYyyYK",
        "KYYYyYYYYYYyYYyYYYYYYYyYYyYYyyYK",
        "KYYYyYYYYYYyYYyYYYYYYYYyYyYYyyYK",
        "KYYYyYYYYYYyYYyYYYYYYYYyYyYYyyYK",
        "KYYYyYYYYYYyYYyYYYYYYYYyYyYYyyYK",
        "KYYYyYYYYYyYYYyYYYYYYYYyYyYYyyYK",
        "KYYYyYYYYYYyYYYyYYYYYYyYYyYYyyYK",
        "KYYYyYYYYYYyYYYyYYYYYYyYYYyYyyYK",
        "KYYyYYYYYYYyYYYyYYYYYYYyYYyYyyYK",
        "KYYyYYYYYYYyYYYYyYYYYYyYYyYYyyYK",
        "KYYyYYYYYYYYyYYyYYYYYYyYYYyYyyYK",
        "KYYyYYYYYYYYyYYYyYYYYYyYYYyYyyYK",
        "KYyYYYYYYYYYyYYyYYYYYyYYYYyYyyYK",
        "KYyYYYYYYYYYyYYyYYYYYyYYYYyYyyYK",
        "KYyYYYYYYYYyYYYyYYYYYyYYYYyYyyYK",
        "KyYYYYYYYYYyYYYYyYYYyYYYYYyYyyYK",
        "KyYYYYYYYYYyYYYYyYYYyYYYYyYYyyYK",
        "KyYYYYYYYYYyYYYYyYYYyYYYYyYYyyYK",
        "KyYYYYYYYYYYyYYYyYYYyYYYYyYYyyYK",
        "KYyYYYYYYYYYyYYYyYYYYyYYYyYYyyYK",
        "KYyYYYYYYYYYyYYYyYYYYyYYYyYYyyYK",
        "KYyYYYYYYYYYyYYyYYYYYyYYYyYYyyYK",
        "KYyYYYYYYYYYyYYYyYYYyYYYYyYYyyYK",
        "KYyYYYYYYYYYyYYyYYYYyYYYYyYYyyYK",
        "KYyYYYYYYYYyYYYyYYYYyYYYYyYYyyYK",
        "KYyYYYYYYYYyYYYyYYYYyYYYYyYYyyYK",
        "KYYyYYYYYYYYyYYyYYYYyYYYYyYYyyYK",
        "KYYyYYYYYYYYyYYyYYYYyYYYYyYYyyYK",
        "KYYYYYYYYYYYYYYYYYYYYYYYYYYYYYYK",
        ".KYYYYYYYYYYYYYYYYYYYYYYYYYYYYK.",
        "..KKKKKKKKKKKKKKKKKKKKKKKKKKKK.."
      ]
    }
  ]
}
