{
  "schemaVersion": 1,
  "name": "scenery_78f2",
  "size": {
    "w": 24,
    "h": 24
  },
  "origin": {
    "x": 0,
    "y": 0
  },
  "legend": {
    ".": -1,
    "K": 0,
    "r": 2,
    "g": 4,
    "R": 10,
    "G": 12
  },
  "frames": [
    {
      "id": "f0",
      "rows": [
        "........................",
        "........................",
        "........................",
        "............K...........",
        ".........KKKGKKKKK......",
        ".......KKGGGGgGGgGKK....",
        "......KGGGGgGGGGgGGGK...",
        ".....KKGGGGGGGGGGGGgGK..",
        "....KGGGgGGGGGGGGGGgGGK.",
        ".....KGgGGGGGGGGGGGggGGK",
        "....KKGGKGGGRRRKGKGGgGGG",
        "...KGGKgGGGKRRRKKGGGggGG",
        "...KGGgKGKGKrrrKKGGGKgGG",
        "..KGGGgKGGKKrrrK.KGKGgKK",
        "..KGKKK.KGKRRRK..KGGKK..",
        "...K.....KKRRRKKK.KK....",
        "....KKKK..KrrrGGGK......",
        "..KKGGggKKKrrrGgGGK.....",
        ".KGGGgGGGGKRRRGGgGGKKKK.",
        "KGGGGGgGGGgRRRGGGGGGGgGK",
        "KGGGGGGGgGgrrrgGGGGGGGGK",
        "KGgGGGGgGGgrrrGGGGGGGGGK",
        "KGGGGGGgGGGRRRGGGGGgGGgK",
        "KGGGGGGGGGGRRRGGGGGGGGGK"
      ]
    }
  ]
}
