{
  "schemaVersion": 1,
  "name": "vermin_parrot",
  "size": {
    "w": 16,
    "h": 12
  },
  "origin": {
    "x": 8,
    "y": 12
  },
  "legend": {
    ".": -1,
    "K": 0,
    "g": 4,
    "y": 6,
    "B": 9,
    "R": 10,
    "G": 12
  },
  "frames": [
    {
      "id": "walk0",
      "rows": [
        "......K.KKKK....",
        ".....KgKRRRRK...",
        "....KgggRRKRyK..",
        "....KgggRRRRyyK.",
        "...KGggggRRRKK..",
        "...KGGGGGGKK....",
        "...KGGGGGGK.....",
        ".KKBGGGGGGK.....",
        "KBBBKGGGGK......",
        ".KKK.KKyK.......",
        "......KyK.......",
        "......KyK......."
      ]
    },
    {
      "id": "walk1",
      "rows": [
        "........KKKK....",
        ".......KRRRRK...",
        ".....KKKRRKRyK..",
        "....KGgGRRRRyyK.",
        "...KGgggRRRRKK..",
        "...KGGGGGGKK....",
        "...KGGGGGGK.....",
        "..KBGGGGGGK.....",
        ".KBBKGGGGK......",
        "KBKK.KKyK.......",
        ".K....KyK.......",
        "......KyK......."
      ]
    }
  ],
  "mirror": {
    "walk0_l": {
      "from": "walk0",
      "flipX": true
    },
    "walk1_l": {
      "from": "walk1",
      "flipX": true
    }
  }
}
